{
  "type": "object",
  "properties": {
    "format": {
      "const": "kozel-game-v2"
    },
    "status": {
      "const": "needs_review"
    },
    "source": {
      "type": "object",
      "properties": {
        "sha256": {
          "type": "string",
          "pattern": "^[a-fA-F0-9]{64}$"
        },
        "game_number": {
          "type": "integer",
          "minimum": 1
        }
      },
      "required": [
        "sha256",
        "game_number"
      ],
      "additionalProperties": false
    },
    "fishVariant": {
      "enum": [
        "withEggs",
        "withoutEggs"
      ]
    },
    "scoreLimit": {
      "enum": [
        50,
        101
      ]
    },
    "teams": {
      "type": "array",
      "items": {
        "$ref": "#/$defs/team"
      },
      "minItems": 2,
      "maxItems": 2
    },
    "rounds": {
      "type": "array",
      "items": {
        "type": "object",
        "properties": {
          "number": {
            "type": "integer",
            "minimum": 1
          },
          "deal": {
            "type": "object",
            "minProperties": 4,
            "maxProperties": 4,
            "additionalProperties": {
              "anyOf": [
                {
                  "type": "null"
                },
                {
                  "type": "array",
                  "items": {
                    "$ref": "#/$defs/stone"
                  },
                  "minItems": 7,
                  "maxItems": 7,
                  "uniqueItems": true
                }
              ]
            }
          },
          "moves": {
            "type": "array",
            "items": {
              "$ref": "#/$defs/move"
            }
          },
          "origin_events": {
            "type": "array",
            "items": {
              "$ref": "#/$defs/move"
            }
          },
          "result": {
            "type": "null"
          },
          "evidence": {
            "type": "object"
          }
        },
        "required": [
          "number",
          "deal",
          "moves",
          "origin_events",
          "result",
          "evidence"
        ],
        "additionalProperties": false
      },
      "minItems": 1
    },
    "result": {
      "type": "null"
    },
    "diagnostics": {
      "type": "array",
      "items": {
        "type": "object"
      }
    }
  },
  "required": [
    "format",
    "status",
    "source",
    "fishVariant",
    "scoreLimit",
    "teams",
    "rounds",
    "result"
  ],
  "additionalProperties": false,
  "$schema": "https://json-schema.org/draft/2020-12/schema",
  "$defs": {
    "name": {
      "type": "string",
      "minLength": 1,
      "pattern": "\\S"
    },
    "stone": {
      "type": "string",
      "enum": [
        "0-0",
        "0-1",
        "0-2",
        "0-3",
        "0-4",
        "0-5",
        "0-6",
        "1-1",
        "1-2",
        "1-3",
        "1-4",
        "1-5",
        "1-6",
        "2-2",
        "2-3",
        "2-4",
        "2-5",
        "2-6",
        "3-3",
        "3-4",
        "3-5",
        "3-6",
        "4-4",
        "4-5",
        "4-6",
        "5-5",
        "5-6",
        "6-6"
      ]
    },
    "team": {
      "type": "object",
      "properties": {
        "id": {
          "type": "string",
          "minLength": 1,
          "pattern": "^[a-zA-Z0-9_-]+$"
        },
        "name": {
          "$ref": "#/$defs/name"
        },
        "players": {
          "type": "array",
          "items": {
            "$ref": "#/$defs/player"
          },
          "minItems": 2,
          "maxItems": 2
        }
      },
      "required": [
        "id",
        "name",
        "players"
      ],
      "additionalProperties": false
    },
    "player": {
      "type": "object",
      "properties": {
        "name": {
          "$ref": "#/$defs/name"
        },
        "seat": {
          "type": "integer",
          "minimum": 1,
          "maximum": 4
        }
      },
      "required": [
        "name",
        "seat"
      ],
      "additionalProperties": false
    },
    "move": {
      "type": "object",
      "properties": {
        "event_id": {
          "type": "string",
          "minLength": 1
        },
        "recognition_status": {
          "enum": [
            "confirmed",
            "unresolved",
            "supplied"
          ]
        },
        "player": {
          "type": [
            "string",
            "null"
          ],
          "minLength": 1
        },
        "action": {
          "enum": [
            "start",
            "left",
            "right",
            "pass",
            "unknown"
          ]
        },
        "stone": {
          "type": [
            "string",
            "null"
          ],
          "pattern": "^[0-6]-[0-6]$"
        },
        "interval": {
          "type": "array",
          "items": {
            "type": "number",
            "minimum": 0
          },
          "minItems": 2,
          "maxItems": 2
        },
        "reason": {
          "type": [
            "string",
            "null"
          ]
        },
        "candidates": {
          "type": "array",
          "items": {
            "type": "object"
          }
        },
        "parent_event_id": {
          "type": "string",
          "minLength": 1
        },
        "anchors": {
          "type": [
            "object",
            "array"
          ]
        },
        "metadata": {
          "type": "object",
          "properties": {
            "unknown_count": {
              "type": [
                "integer",
                "null"
              ],
              "minimum": 1
            },
            "order_candidates": {
              "type": "array"
            }
          },
          "required": [
            "unknown_count",
            "order_candidates"
          ],
          "additionalProperties": false
        },
        "review_resolution": {
          "const": "no_move"
        }
      },
      "required": [
        "event_id",
        "recognition_status",
        "player",
        "action",
        "interval",
        "reason",
        "candidates"
      ],
      "additionalProperties": false,
      "allOf": [
        {
          "if": {
            "properties": {
              "action": {
                "const": "pass"
              }
            }
          },
          "then": {
            "not": {
              "required": [
                "stone"
              ]
            }
          },
          "else": {
            "required": [
              "stone"
            ]
          }
        },
        {
          "if": {
            "required": [
              "review_resolution"
            ]
          },
          "then": {
            "properties": {
              "recognition_status": {
                "const": "supplied"
              },
              "player": {
                "type": "null"
              },
              "action": {
                "const": "unknown"
              },
              "stone": {
                "type": "null"
              }
            },
            "not": {
              "required": [
                "parent_event_id"
              ]
            }
          }
        }
      ]
    }
  }
}
